{"$id":"https://orbital-dynamics.local/schemas/maneuver_recommendation.v1.schema.json","$schema":"https://json-schema.org/draft/2020-12/schema","additionalProperties":true,"properties":{"assumptions":{"type":"object"},"delta_v_km_s":{"items":{"type":"number"},"maxItems":3,"minItems":3,"type":"array"},"delta_v_magnitude_km_s":{"type":"number"},"epoch_s":{"type":"number"},"epoch_scale":{"type":"string"},"frame":{"type":"string"},"id":{"pattern":"^[A-Za-z0-9][A-Za-z0-9._:@-]*$","type":"string"},"maneuver_model":{"type":"string"},"model_limits":{"items":{"enum":["impulsive_burn_only","recommendation_only_no_command_execution","no_finite_burn_model","requires_operator_review_before_execution"],"type":"string"},"type":"array"},"scenario_id":{"pattern":"^[A-Za-z0-9][A-Za-z0-9._:@-]*$","type":"string"},"schema_contract":{"const":"maneuver_recommendation.v1","description":"Stable executable contract identifier","type":"string"},"type":{"type":"string"},"validation_level":{"type":"string"}},"required":["schema_contract","id","scenario_id","type","epoch_s","frame","delta_v_km_s","maneuver_model","assumptions"],"title":"OrbitalDynamics maneuver_recommendation.v1","type":"object","x-orbital-dynamics":{"artifact_family":"maneuver_recommendation","compatibility_policy":{"breaking_change_action":"mint a new schema_contract name or increment the artifact schema_version before publishing","breaking_changes":["remove_required_fields","change_required_field_type","change_schema_contract_identifier","change_schema_version_const","change_required_field_semantics"],"compatible_changes":["add_optional_fields","add_optional_nested_contracts","tighten_executable_semantic_validation_without_changing_exported_required_fields"],"policy_version":1,"validation_mode":"top_level_compatibility_export"},"compatibility_policy_version":1,"executable_contract":true,"identity_policy":{"breaking_changes":["change_existing_public_identifier_for_the_same_semantic_entity","emit_blank_identifier","emit_identifier_with_whitespace"],"compatible_changes":["add_optional_identifier_fields","add_more_specific_semantic_source_metadata_without_changing_existing_ids"],"description":"Public artifact identifiers are non-empty machine identifiers without whitespace.","generated_id_scopes":[{"identity_fields":["scenario_id","type","source_window_id","target_id","ground_station_id"],"ordering":["result_event_type","scenario_id","source_window_id","starts_at_s"],"scope":"candidate_refresh.v1.candidate_activities"},{"identity_fields":["spacecraft_id","scenario_id","epoch.seconds_since_j2000"],"ordering":["spacecraft_id","scenario_id","epoch.seconds_since_j2000"],"scope":"accepted_planning_state.v1.spacecraft_states"}],"policy_version":1,"semantic_invariants":["source_record_order_must_not_change_generated_identity","semantic_source_identity_must_remain_stable_across_manifest_export","scenario_and_activity_identity_must_not_depend_on_wall_clock_time"],"stable_id_pattern":"^[A-Za-z0-9][A-Za-z0-9._:@-]*$"},"identity_policy_version":1,"nested_contract_definition_scope":"direct_declared_contracts","nested_contracts":[],"schema_contract":"maneuver_recommendation.v1","schema_version":1,"validation_mode":"top_level_compatibility_export"}}
