{"assumptions":{"execution_boundary":"recommendation_only_no_command_execution","source":"trajectory_assumptions"},"delta_v_km_s":[0.0,0.01,0.0],"delta_v_magnitude_km_s":0.01,"epoch_s":180.0,"epoch_scale":"tdb","frame":"eci_j2000","id":"trim_burn","maneuver_model":"impulsive_burns","model_limits":["impulsive_burn_only","recommendation_only_no_command_execution","no_finite_burn_model","requires_operator_review_before_execution"],"scenario_id":"ops_checkout","schema_contract":"maneuver_recommendation.v1","type":"impulsive_burn","validation_level":"artifact_contract"}
